s1|s2|sts_score|metric_score
those who ignore history are doomed to repeat it.|ooo strike TWO those who ignore history are doomed to repeat it.|0.8400000000000001|0.8375327587127686
this is NOT a war deployment.|its not an official deployment.|0.48|0.8511574268341064
Nutrax The plural of anecdote is not data Did gentlemen need chaperones?|Nutrax The plural of anecdote is not data|0.72|0.7660142779350281
Alright just got in.|not well Alright just got in.|0.8|0.8885902166366577
h and i both read the books and thought the movie moved so quickly.|I haven't read the books, but I saw the movie today.|0.6|0.6259432435035706
That's not the Moloch scene, though.|This is the Moloch scene.|0.48|0.8059259653091431
@Lustig Andrei, So Lyndon Johnson and John Kennedy were compatible?|@edgarblythe, So Lyndon Johnson and John Kennedy were compatible?|0.8800000000000001|0.8618399500846863
You need to make up your mind.|You need to polish up on your logic skills.|0.12|0.6459492444992065
The one that has  walks home afterwards and goes to sleep.|The one that has three walks home and beats his wife.|0.2799999999999999|0.5545461177825928
- Admin DrPizza and i'd forgotten what a whiny little bed wetter you are.|and i'd forgotten what a whiny little bed wetter you are.|0.76|0.7737299799919128
"The argument was ""Albert Einstein didn't go to college""."|"OMG, ""Einstein didn't go to college."""|0.8400000000000001|0.8181350827217102
Capital gains, top rate:  percent.|Income tax, top rate:  percent.|0.48|0.7247588038444519
Bienging is unaccptable.|Being drunk is unacceptable.|0.2|0.6097797751426697
He hasn't been funny in years.|He hasn't been funny since Larry Bud Melman was on the show.|0.6799999999999999|0.7367923259735107
If the universe has an explanation of its existence, that explanation is God.|Therefore, the universe has an explanation of its existence.|0.48|0.8077709674835205
What do we get in return for doing the fighting for them?|------ ----------- What do we get in return for doing the fighting for them?|1.0|0.8758137822151184
It wouldn't stop joke marriages.|And I don't fight for marriage.|0.24|0.5626115202903748
If they were Jews, I would call them Jews.|If they were Catholics, I would call them Catholics.|0.44|0.7944080233573914
She was a great lady.|She was a nice lady.|0.8|0.9133585095405579
He's not wealthy because he's successful.|Why hate people because they are successful?|0.16|0.5667900443077087
Not as irritated as you.|You seem as irritated as Henry.|0.35|0.7802968621253967
It's a common sense/deductive reasoning thing.|Hilited your common sense/deductive reasoning thing.|0.5|0.7684932351112366
You already did that - we have a Muslim in office right now.|-CryptoLutheran No. We have a Christian in office right now.|0.16|0.6841608285903931
I said she has not ever had to be a part of any workforce.|Ann Romney has never had to get out and be a part of the workforce.|0.6799999999999999|0.7538235783576965
DreamTech never been ejaculated on as far as I know.|It has never been ejaculated on as far as I know.|0.6|0.8125664591789246
I didn't say we had gotten soft since / Rand.|I said YOU had gotten soft.|0.24|0.683740496635437
We all believe that we are getting what we expect.|Most times, % of the time, we are getting what we expect.|0.76|0.7646117806434631
Despicable Ben, Stop trying to find excuses for the man.|Ben, Stop trying to find excuses for the man.|0.8800000000000001|0.8780450820922852
Unless it's different in different countries?|So, short form, yes, it probably is different in different countries.|0.72|0.672631025314331
The new study does not support your claim.|The physical evidence does not support your claim.|0.44|0.8347803950309753
He said at EVERY level.|But he said EVERY level.|0.92|0.8240775465965271
morals do not exist, so technically nothing can be morally wrong.|I ask again if God does not exist can anything be morally wrong?|0.44|0.7621551752090454
I thought that was mostly just the Dutch.|It is mostly just the Dutch.|0.8|0.8421608209609985
Toyland by Johnny Mathis We are all vessels filled with many wonders.|Eye of the Tiger We are all vessels filled with many wonders.|0.64|0.7508987188339233
Let's let this play out in court.|Nothing is stopping this thing from playing out in court.|0.76|0.7284344434738159
Being in a gang isnt a crime.|Commiting a crime in a gang is a crime.|0.36|0.7913278937339783
I'd offer Iran a deal.|Chuck I'd offer Iran a deal.|0.8400000000000001|0.9127886295318604
Yes, they are both different.|Opinions are different.|0.24|0.6501950621604919
It's not imposing morals.|It's imposing a law.|0.22|0.7550383806228638
Has Annie ever used her sexuality like that?|One word: Zombies Has Annie ever used her sexuality like that?|0.76|0.7955045104026794
PURE COMMUNISM: You have two cows.|LIBERTARIAN/ANARCHO-CAPITALISM: You have two cows.|0.48|0.6600093841552734
You should put scientists on a pedestal.|Why do people like you put scientist on a pedestal?|0.6799999999999999|0.8072603940963745
What are they trying to hide?|I then asked: What are they trying to hide?|0.72|0.886213481426239
That would make you partially responsible for their death.|That would make you a sort of accessory, I think.|0.6|0.5652384757995605
"""Would you like to pay for others health care?"""|"""Would you like to wear your seatbelt?"""|0.0|0.5384553074836731
They are NOT as sovereign as they were before.|to repeat: They are NOT as sovereign as they were before.|0.8800000000000001|0.9040037989616394
I don't see Obama as the lesser of two evils.|I don't see him as evil at all.|0.4|0.732654333114624
Or this one by Jim Croce We are all vessels filled with many wonders.|We are all vessels filled with many wonders.|0.64|0.8235073685646057
The point is an unarmed child was murdered.|The point is an unarmed child was murdered who was black.|0.6799999999999999|0.8886863589286804
"Zimmerman replied, ""What are you doing here?"""|"Martin said, ""Why are you following me?"""|0.18|0.7096036076545715
Irreligion that does that I have a problem.|Religion that doesn't do that I don't have a problem with.|0.32|0.6681007146835327
If I'm angry, it will show up in one of those scans..|If I'm hyper active, it will show up in one of those scans..|0.64|0.8129882216453552
If you want to buy $ billion in XYZ Inc. common stock, who cares?|If you want to buy a house or a SUV, again, who cares?|0.2799999999999999|0.6054880023002625
billion . Everyone in the world at Mexico's current prosperity level.|"Everyone in the world at the current ""prosperity"" level of Northwest Africa."|0.306666666666666|0.6480926871299744
If you answer yes to  and no to  you are probably straight.|If you answer no to  but yes to  then you are probably straight.|0.62|0.8677971959114075
Sometimes I fantasize about having power.|Sometimes I, too, fantasise about bending people before my demented will.|0.8400000000000001|0.6423901915550232
My parents have told me it is bad for you.|My Sheriff has told me its bad for you.|0.5599999999999999|0.738128125667572
Atlas Shrugged It's also a stellar performer in terms of blithering idiocy.|It's also a stellar performer in terms of blithering idiocy.|0.72|0.7783740162849426
How would Martin not know that that was not the case?|How would Martin or anyone else know his intentions based on his actions?|0.48|0.6443702578544617
Regulation get the government into everything.|"""Get the government into everything?"""|0.48|0.7385457158088684
It's a common sense/deductive reasoning thing.|Hilited your common sense/deductive reasoning thing.|0.5|0.7684934139251709
Yes, I've assumed that all packaging would be recyclable in my argument.|I've assumed this as well in my argument.|0.5599999999999999|0.6645941138267517
Jury nullification does not mean that a law is unconstuitutional.|Jury nullification means a law isn't Constitutional?|0.72|0.840449333190918
It's just a bunch of cells.|"I'm ""a bunch of cells."""|0.44|0.8357832431793213
Mann's work was all about math.|Mann's work and the HS was all about Tree rings.|0.32|0.7043381333351135
I'm so sorry to hear this Kelly.|I'm so sorry, Kelly.|0.8|0.8652655482292175
I don't like flavored beers.|I don't like many flavored drinks.|0.6|0.8566510081291199
I hope everything is ok!|I hope your LO is ok.|0.32|0.8052459955215454
any woman that wants birth control can get it.|Any woman that wants and abortion can get one.|0.32|0.7860766053199768
S As you wish: Do you see Hitler killing Jews?|Do you see Hitler killing Jews?|0.92|0.7286288738250732
And I'm your friend Mitt.|Your good friend Mitt.|0.8|0.7290470600128174
It means its AN option.|Doesnt mean its a BAD option.|0.32|0.6316139101982117
I think you need to reread what I wrote.|You need to reread what I wrote.|1.0|0.9193771481513977
lets assume we have % white and % black.|Imagine a place that's % white and % black.|0.755555555555556|0.7310071587562561
"Mom busted in and said, ""What's that noise?"""|My kids busted in and said 'whats that Dad?'|0.36|0.7841401100158691
My best, Kutte My ex-fiance wouldn't use the VA or Navy doctor's.|Jay My ex-fiance wouldn't use the VA or Navy doctor's.|0.72|0.786588728427887
Holder filed a three-page letter.|The Judges orders a three-page letter to be filed.|0.5599999999999999|0.7426536679267883
@Lustig Andrei, Lustig, agreed.|@Lustig Andrei, Thank you, Lustig.|0.44|0.8867822885513306
This eclipses the old record of  set in .|This breaks the daily record of  set in .|0.96|0.8260194659233093
"Zimmerman replied, ""What are you doing here?"""|"Martin said, ""Why are you following me?"""|0.18|0.7096036076545715
I don't know how legitimate this is, but I heard he's kind of suicidal.|So, I don't know how legitimate this is but yeah.|0.32|0.7248583436012268
council tax Hasn't council tax been frozen for most people?|Hasn't council tax been frozen for most people?|0.96|0.8602451682090759
Your schtick is getting stale.|Your misogyny is getting messy.|0.08|0.616807222366333
Is that how it works?|Nah, that's not how it works.|0.32|0.8165323138237
Breathe In, Breathe Out, Move On.|buwhahahaha Breathe In, Breathe Out, Move On.|0.8800000000000001|0.8555785417556763
wait until they become more consistent and closer together.|wait for the contractions to get stronger and closer together.|0.76|0.7226008772850037
Obama is extreme and leftwing.|Obama is part of the extreme leftwing.|0.96|0.8784598112106323
@Frank Apisa, What you want to call it is up to you.|@Cyracuz, What you want to call it is up to you.|0.5|0.8959947824478149
Jury nullification has NOTHING to do with the Constitutionality of laws.|Jury nullification means a law isn't Constitutional?|0.52|0.7771747708320618
What conviction where you talking about before?|What conviction would that be?|0.8800000000000001|0.6372223496437073
So I actually read the OP and guess what I found out.|Furthermore I found this: So I actually read the OP and guess what I found out.|0.92|0.8670878410339355
The government does not determine if you are married or not.|The government doesnt have to declare you married before you can be married.|0.72|0.7493829131126404
Democracy is a threat to liberty.|Democracy has nothing to do with liberty.|0.36|0.7839977145195007
Hi Pro and Corn: How many threads do you plan on making?|How many threads do you plan on making?|0.8|0.7105318307876587
Tell me exactly which system isn't working right now?|So which system isn't working for us?|0.8|0.8234688639640808
Oh, and again asserts that marriage is a fundamental human right.|Particularly after stating that marriage is a fundamental human right.|0.8|0.7774780988693237
Why are Russians in Damascus?|Russians in Damascus!|0.8400000000000001|0.8948126435279846
Yes, it's about dilution.|Er, that's not how dilution works.|0.36|0.8005952835083008
Yeah, I don't think this is that controversial either.|I don't think what she's saying is that controversial.|0.76|0.8237254023551941
Operation Chaos is merely people voting.|Chaos is merely people voting.|0.8|0.9038174748420715
Originally Posted by JonD Doubtful.|Originally Posted by eleanor.ellis|0.24|0.6202415823936462
Classical Gas We are all vessels filled with many wonders.|The theme song to Cheers: We are all vessels filled with many wonders.|0.6|0.7185242772102356
to repeat: They are NOT as sovereign as they were before.|They are NOT as sovereign as they were before.|0.9|0.8959654569625854
Morals have absolutely nothing to do with it !|and morals and honesty have everything to do with it.|0.4|0.7521066069602966
i be having conversations will cornell west My dear brother.|i be having conversations will cornell west What the hell is this?|0.6|0.7137667536735535
There is no war in the Middle east.|"There is no ""WAR"" in the middle east."|0.92|0.8972969651222229
He had no intention of apprehending him.|- I didnt say he planned on apprehending him.|0.48|0.8330435156822205
We are all vessels filled with many wonders.|Put a Little Love in your Heart We are all vessels filled with many wonders.|0.72|0.7615501284599304
"You're ""a bunch of cells."""|"I'm ""a bunch of cells."""|0.48|0.9105930924415588
What is a girl douche?|You are a girl douche.|0.2799999999999999|0.7192073464393616
Jury nullification means a law isn't Constitutional?|No. Jury nullification does not mean that a law is unconstuitutional.|0.4|0.8084433674812317
It's definitely NOT what it used to be.|voted Voted It's definitely NOT what it used to be.|0.8|0.780404269695282
The onus is on the manufacturer of a product to convince consumers it is safe.|The manufacturer has to convince the government it's safe.|0.6799999999999999|0.8146620988845825
I think you are missing the point with entrepreneurs.|Again I think you are missing the point on the Twain quote.|0.16|0.7589231133460999
"""Cyclopes don't exist"" - fine."|"""Goblins don't exist"" - fine."|0.32|0.8377400040626526
"""In  it was a mental illness, now what are they teaching you?"""|He stated that it was a mental illness in , how is that bigotry?|0.32|0.5672585368156433
Landon And So This is Christmas We are all vessels filled with many wonders.|Play With Fire We are all vessels filled with many wonders.|0.36|0.7006960511207581
Bush gets zero credit for the budget under him.|And, Obama gets zero credit for the budget under him.|0.36|0.8993401527404785
. Sinful people do not get to heaven.|Or sin is removed upon entry to heaven.|0.36|0.6781806945800781
How long after the obliteration should the kid return to school?|How long after the obliteration should it no longer bother the kid?|0.6|0.781989336013794
Holly Holy We are all vessels filled with many wonders.|Say What You Will We are all vessels filled with many wonders.|0.76|0.7270793914794922
"What was the ""answer"" in Chicago?"|What will be the response in California?|0.24|0.734481155872345
The entire thing just makes no sense.|See that makes no sense.|0.8400000000000001|0.8498191237449646
Who supposedly operated the homicidal gas chambers?|Refresh your memory: Who supposedly operated the homicidal gas chambers?|0.96|0.8406662344932556
Therefore, the explanation of the existence of the universe is God.|If the universe has an explanation of its existence, that explanation is God.|0.72|0.8095555305480957
Genetic predisposition to cancer resistance is superior genetics.|Genetic predisposition to Alzheimer is inferior genetics.|0.2799999999999999|0.778609037399292
Do you notice the nonsensical things you are saying?|And to be fair, do you notice the nonsensical things you are saying?|0.914285714285714|0.8556668162345886
Use of force in defense of person.-A|Use of force by aggressor.|0.24|0.5654739737510681
That's what the data available shows.|That's what the historical record shows.|0.72|0.834277868270874
Joy to the World We are all vessels filled with many wonders.|The theme song to Cheers: We are all vessels filled with many wonders.|0.6|0.8015113472938538
I thought that was mostly just the Dutch.|In fact, it's just the Dutch.|0.52|0.7974662184715271
Ive watched kids play.|I like watching kids play.|0.44|0.8565461039543152
David @OmSigDAVID, I think Santorum's more likely than Gingrich.|@sozobe, I think Santorum's more likely than Gingrich.|0.96|0.8561468720436096
They're looking at each other!|Why are they looking at each other like that ?!?!|0.5599999999999999|0.7322885990142822
Are you driving one?|Are you driving a fucking Volt?|0.52|0.7117482423782349
Religion that does that I have a problem with.|Irreligion that doesn't do that I don't have a problem with.|0.2799999999999999|0.7229021191596985
I think he'd be better for American business interests overall.|Would he be better for American society?|0.32|0.7692151665687561
not a constitutional issue.|again, this is not a constitutional issue.|0.8800000000000001|0.902328610420227
YOU FOOLS..bought the  cover-up..hook..|Hi Eots: YOU FOOLS..bought the  cover-up..hook..|0.8400000000000001|0.8540531396865845
"""What does pressing the number one do?"""|"""Pressing the number one does English."""|0.32|0.754748523235321
What conviction would that be?|What conviction where you talking about before?|0.8800000000000001|0.6944183111190796
Originally Posted by spikdboy Not wishful thinking, rather realistic.|Originally Posted by objectivism Not wishful thinking, rather realistic.|0.76|0.8499557375907898
For the trillionth time, I've never said rehabilitation doesn't work.|"The point you quote should say ""I never said rehabilitation could never work."""|0.6799999999999999|0.7343582510948181
Charlie Rangel Censured Did anyone see the footage of this?|Did anyone see the footage of this?|0.6|0.7113339304924011
Red October standing by.|Red Fox standing by.|0.4|0.8270631432533264
That's just not how legal briefs are written.|That just isn't how legal reasoning works.|0.64|0.7763145565986633
No, none of those factors account for the recent warming.|You don't know if those factors account for the warming, or not.|0.6|0.8013991713523865
Stone notified Captain Lord.|He too notified Captain Lord.|0.6799999999999999|0.8250625729560852
The primary focus of Systematic Dialectics is syn chronic, not dia chronic.|Thus, Meta - System - atic Dialectic is Diachronico - Synchronic Dialectic.|0.44|0.6757655739784241
Are you driving one?|Are you driving a fucking Volt?|0.52|0.7117482423782349
And that is happening in GOP controlled states.|Michigan IS a GOP controlled state.|0.16|0.7904970645904541
in  Foxe basin was frozen.| Foxe was mostly frozen.|0.8400000000000001|0.6818966269493103
@Frank Apisa, Frank, I observe and perceive.|@cicerone imposter, Frank, I observe and perceive.|0.8400000000000001|0.6986472606658936
Government deciding what pregnancies need to be carried to term, that's fine.|Government spying on its own citizens, that's fine.|0.24|0.5379548668861389
Put a Little Love in your Heart We are all vessels filled with many wonders.|Landon And So This is Christmas We are all vessels filled with many wonders.|0.5599999999999999|0.6931809186935425
Higher than  per cent but not very high.|Lower than  per cent but not very low.|0.2|0.8962787389755249
What isn't how what was sold?|It's not how it was sold, gb.|0.32|0.6284344792366028
God definately does not exist.|God probably does not exist.|0.52|0.9080350399017334
Breathe In, Breathe Out, Move On.|buwhahahaha Breathe In, Breathe Out, Move On.|0.8800000000000001|0.8555789589881897
It is an excellent indicator of climate change.|I think we all agree on the nature of the change.|0.4|0.6343287825584412
The great thing about living here is there's space.|The bad thing is there's space.|0.36|0.7227135300636292
Ah ha, ha, ha, ha, ha!|Ha, ha, ha, ha, ha, ha!|0.9|0.9542184472084045
I don't understand how freedom of speech will be prohibited.|Your freedom of speech will be no more prohibited than it is today.|0.76|0.7600043416023254
The question needs to be asked.|It is a question that needs to be answered.|0.64|0.8303918242454529
You purport to value life very heavily.|I purport to value human life very highly.|0.5599999999999999|0.814685583114624
The Infestation posts.|The mosquitoes posts.|0.36|0.5876129269599915
i don't want a president who 'cares'.|don't want a president that is compassionate.|0.92|0.7666186690330505
do you have anything to make it less compelling or not?|Do you have anything to make it more compelling?|0.48|0.8012974858283997
For the trillionth time, I've never said rehabilitation doesn't work.|"The point you quote should say ""I never said rehabilitation could never work."""|0.6799999999999999|0.7343582510948181
Classical Gas We are all vessels filled with many wonders.|Time of the Season by the Zombies We are all vessels filled with many wonders.|0.48|0.7100048065185547
peeve So we agree that it came down essentially in freefall?|Do we agree that they came down essentially in freefall?|0.8|0.8588421940803528
Pro-life people do not want a woman to be able to choose abortion for herself.|Pro-choice people do not try to force an abortion on anyone.|0.2|0.7754718661308289
So answer the question.|Stop avoiding the question.|0.6799999999999999|0.7061855792999268
Haiti is a shithole.|Haiti has been a shithole.|0.8400000000000001|0.9337632060050964
I absolutely do believe there was an iceberg in those waters.|I don't believe there was any iceberg at all anywhere near the Titanic.|0.24|0.7097178101539612
The Face Of The Franchise: The worst part is that he's not even a Leafs fan!|The worst part is that he's not even a Leafs fan!|0.8800000000000001|0.7682851552963257
I agree completely I am hoping he is into a second term of office.|I am hoping he is into a second term of office.|0.8|0.8867754340171814
Jake with the assist.|Voracek with the goal.|0.08|0.6478615403175354
Is it possible his home was affected and the school was not?|Sure, it is possible his home was affected, but not the school.|0.64|0.8506495952606201
The people had awakened.|Because the people had awakened.|0.8400000000000001|0.9264540076255798
Umm the California was a cargo ship I dont care what the article says.|The California was a cargo ship.|0.8|0.7189786434173584
"Umm, that pretty clearly states, ""the statute is presumed constitutional."""|"And until they decide that, ""the statute is presumed constitutional."""|0.52|0.8216388821601868
Florida The ignorance is yours!|The ignorance is yours!|0.6799999999999999|0.8688233494758606
I'm going to shout for justice for Trayvon.|The people shouting for justice for Trayvon are all hypocrites.|0.32|0.6989145874977112
How do you know what's right and wrong?|How do you know which story is the right one?|0.44|0.7794097661972046
Ha, ha, ha, ha, ha, ha!|Ah ha, ha, ha, ha, ha!|1.0|0.9637601375579834
And Nugent was a complete fool to say what he said.|Natalie was a complete fool to have insulted their fan base.|0.12|0.6470217108726501
It is all Bush's fault.|Obama is Bush's fault.|0.24|0.8680452704429626
You should stop prefixing or suffixing everything with you hate Jews.|"I don't prefix or suffix everything with ""you hate Jews."""|0.48|0.7481392025947571
I missed the point where he said that black people were going to riot.|Never, did I ever, did I say blacks were going to riot.|0.48|0.716492235660553
Yet you didn't have to declare it.|And you didn't have to.|0.4|0.7629676461219788
Proverbs  John the Baptist was a Nazarite from birth.|John the Baptist was a Nazarite from birth.|0.92|0.8742445111274719
James : says faith without works is dead.|Paul did not preach faith without works.|0.44|0.678068220615387
billion . Everyone in the world at Mexico's current prosperity level.|"Everyone in the world at the current ""prosperity"" level of Northwest Africa."|0.306666666666666|0.6480926871299744
and videos Seismic data does not equal duration of collapse.|Seismic data does not equal duration of collapse.|0.92|0.8363783955574036
Originally Posted by Lone Fox You've said that multiple times now.|Originally Posted by Lone Fox And it's not all Iranian related either.|0.44|0.6493716835975647
You might not like Obamas views, but he has them.|You might not like the positions he holds, but atleast he has them.|0.52|0.701492428779602
But do you actually believe there was an iceberg in those waters?|I absolutely do believe there was an iceberg in those waters.|0.6|0.8319347500801086
There is simply no winning for Obama among conservatives.|This is rich coming from a conservative.|0.2799999999999999|0.5307060480117798
Satan represents indulgence instead of abstinence!|. Satan represents vengeance instead of turning the other cheek!|0.32|0.6257199645042419
Just so long as the tax on that sale is paid.|Just so long as the tax is paid.|0.76|0.8721737265586853
fix?: Islam itself is not political.|Islam has always been political.|0.24|0.6716246008872986
March  is also the date for the uprising in CHINA.|Originally posted by Vitchilo March  is also the date for the uprising in CHINA.|0.8|0.818432629108429
I hope everything is OK!|I hope everything is okay.|1.0|0.949128270149231
Do you understand why it's absurd to limit the question to US residents?|Do you understand why non-US residents are also relevant to the statistics?|0.64|0.7199050188064575
I have seen UFO over Warsaw in the past.|Respectfully submitted, Steve I have seen UFO over Warsaw in the past.|0.8|0.8155421614646912
depending on which action furthers their loony-tunes agenda of the moment.|depending on which action furthers their lonny-tunes agenda.|0.92|0.7521489262580872
Do you further agree that I have made no claim?|So that you will admit and verify that I have made no claim.|0.76|0.7954061627388
Zimmerman says that he was sucker punched by his car.|"His ""friends"" say that he was confronted by his car."|0.48|0.5548096299171448
"There is no ""WAR"" in the middle east."|There is no war in the Middle east.|0.92|0.8908897638320923
Part of pro-life is the opposition to legalized abortion.|"Pro-life also refers to just ""opposition to abortion""."|0.76|0.8235705494880676
